{
  "schema_version": "4.0",
  "case_id": "case001-v2",
  "source_id": "src-authored-order-csv",
  "family_id": "fam-authored-order-csv",
  "task_id": "case001-v2.large_exact_sum",
  "split": "development",
  "purpose": "development",
  "contract_id": "case001-v2.contract-v1",
  "judge_id": "case001-v2.judge-v1",
  "prompt": "Use the supplied skill and orders.csv to write deduplicated.csv and summary.csv in the output directory. Preserve input files and report invalid records.",
  "inputs": {
    "orders.csv": "order_id,customer_id,updated_at,amount\na,C1,2026-01-01T00:00:00Z,123456789012345678901234567890.12\nb,C1,2026-01-01T00:00:00Z,0.01\n"
  },
  "expected": {
    "outcome": "success",
    "outputs": {
      "deduplicated.csv": "order_id,customer_id,updated_at,amount\na,C1,2026-01-01T00:00:00Z,123456789012345678901234567890.12\nb,C1,2026-01-01T00:00:00Z,0.01\n",
      "summary.csv": "customer_id,order_count,total_amount,latest_updated_at\nC1,2,123456789012345678901234567890.13,2026-01-01T00:00:00Z\n"
    },
    "error_record": null,
    "error_field": null
  },
  "covered_rule_ids": [],
  "coverage_note": "Migrated existing development fixture; independent per-rule coverage review is pending"
}
