{
  "schema_version": "4.0",
  "case_id": "case001-v2",
  "source_id": "src-authored-order-csv",
  "family_id": "fam-authored-order-csv",
  "task_id": "case001-v2.empty",
  "split": "development",
  "purpose": "development",
  "contract_id": "case001-v2.contract-v1",
  "judge_id": "case001-v2.judge-v1",
  "prompt": "Use the supplied skill and orders.csv to write deduplicated.csv and summary.csv in the output directory. Preserve input files and report invalid records.",
  "inputs": {
    "orders.csv": ""
  },
  "expected": {
    "outcome": "error",
    "outputs": {},
    "error_record": null,
    "error_field": null
  },
  "covered_rule_ids": [],
  "coverage_note": "Migrated existing development fixture; independent per-rule coverage review is pending"
}
